{
  "model_path": "",
  "context_size": 4096,
  "n_gpu_layers": -1,
  "temperature": 0.7,
  "max_response_tokens": 512,
  "turns_per_period": 5,
  "total_periods": 12,
  "max_memory_tokens": 800,
  "max_world_tokens": 400,
  "max_history_tokens": 600,
  "save_directory": "",
  "use_tui": false,
  "use_color": true,
  "mutation_narration_templates": {
    "give_item_to_player": "{npc} hands you the {item}.",
    "take_item_from_player": "{npc} takes the {item}.",
    "update_npc_mood": "{npc}'s expression shifts - they seem {mood} now.",
    "move_npc": "{npc} excuses themselves and leaves.",
    "reveal_knowledge": "",
    "update_npc_trust": "",
    "add_memory": "",
    "set_flag": ""
  }
}
